ARKK ETF has become a Dumpster fire,-1,7,0.65,1643660695.0
Where is the crash?,-1,7,0.83,1643659992.0
The House (congress) passes bill to counter China's influence with manufacturing and research investment.,0,57,0.75,1643611673.0
Why hasn't AMD jumped higher?,0,0,0.5,1643690968.0
BBL stock converted into BHP?,0,15,0.76,1643637841.0
"I nuked my 42k account on $F calls. No one to blame but myself, would anyone have any suggestions before I walk away for good?",1,8,0.76,1643650094.0
Question about Jan 2021 trading frenzy,-1,34,0.83,1643621706.0
$PERI adtech value opportunity,1,3,0.67,1643666812.0
We all know facebook is going back up,0,2,0.58,1643668691.0
FB at 240 looks so yummy,1,7,0.7,1643643001.0
Where Can I Find Earnings Reports Dates?,0,3,0.56,1643652976.0
1 stock & 1 stock only update,0,0,0.5,1643678880.0
"With auto companies dumping copious amounts of money into EV, what are your picks for stocks/industries that will benefit from this push?",0,153,0.79,1643579803.0
Bloomberg analysis of January: Institutions in the drivers seat,0,75,0.8,1643590523.0
"Comparing Now to 2020, 2018 and 2008 crashes...",0,49,0.78,1643597284.0
Is Google’s ‘phenomenal’ fiscal run about to end?,0,23,0.75,1643606852.0
What to do with SQ?,0,20,0.87,1643611119.0
I don’t understand the inflation rate! The prices are way higher than what’s it’s been reported,0,7,0.65,1643631314.0
DUOL valuation and expectations?,0,6,0.6,1643631022.0
Google stock split and dividends,0,1,0.67,1643659322.0
Today the the prime example why timing the market is a bad idea,-1,12,0.77,1643613843.0
CPI Base Effect Kicks In February 2022 | Growth Stock Short Squeeze,1,2,0.6,1643644574.0
"FB , METV, VTSAX Opinions on these stocks?",0,2,0.75,1643643914.0
ARVL (arrival stock) is it worth it?,1,0,0.45,1643696756.0
$PYPL down -53% from ATH. Any fundamental reason?,0,0,0.5,1643650838.0
Did MTCH beat or missed EPS?,-1,41,0.62,1643571744.0
Is Meta (FB) horribly mismanaged?,-1,3,0.64,1643623034.0
I'm rly proud of myself.,1,232,0.93,1643536764.0
Amazon Prime's price increase will result in an increase of ~$4B in annual revenue for Amazon,1,6034,0.95,1643467230.0
Investing in 5G?,0,5,0.78,1643600967.0
Google announces 20:1 stock split. $2750 -> $137.50*,0,0,0.5,1643630412.0
Fed Rate Hike Sell Off Before Meeting in March,0,1041,0.94,1643493372.0
Outlook on base metals for the next 5 or so years?,0,18,0.89,1643566370.0
What is too much power?,0,1,0.56,1643618937.0
How do you think the recently passed America competes bill will impact Intel?,0,272,0.89,1643504824.0
Investing in metaverse,0,0,0.3,1643660411.0
Buying stocks: commission free or pay low commission,1,17,0.76,1643555993.0
FGI Setting Up to Double,0,102,0.83,1643519626.0
Change My Mind: Google is the safest stock to invest in?,1,0,0.43,1643659457.0
Moderna’s HIV Vaccine Has Officially Begun Human Trials,0,7,0.82,1643565377.0
Using regression analysis to forecast sales in a SAaS firm?,0,75,0.92,1643519863.0
Have market reactions to earnings always been this extreme?,0,0,0.33,1643621725.0
Ok to not have a balanced portfolio?,1,34,0.85,1643531279.0
Looking to expand my portfolio with ETFs,1,6,0.75,1643564299.0
Spotify Loses $2 Billion as Stock Plummets After Neil Young’s Joe Rogan Protest,-1,3,0.62,1643562008.0
Best earning plays next two weeks,1,0,0.34,1643624769.0
Should I buy on margin?,0,11,0.58,1643532814.0
How to track congressmen stock activities?,0,3,0.8,1643554044.0
Opinion about WeWork and Masa Son,0,47,0.78,1643496983.0
USER testing?,0,86,0.76,1643483263.0
STEM is about to explode because 50-60% of their revenues are in Q4 and they aren't priced for it,0,0,0.46,1643583407.0
Am I the only one who thinks the market got FB and AMZN wrong?,-1,35,0.83,1643480849.0
How to setup a recurring monthly payment through comsec into a single ETF,0,7,0.83,1643510670.0
Rate My Portfolio - r/Stocks Quarterly Thread December 2021,0,52,0.9,1643472839.0
"AMZN lives! But the FAANG is dead. FB and NFLX dont belong on the Mt Rushmore of Tech Giants, who replaces them?",-1,25,0.9,1643489550.0
Microsoft Holo Lens reportedly cancelled. 15 Microsoft employees join Meta to work on VR,0,11,0.88,1643495019.0
Questions about the AT&T and Discovery Spinoff into Warner BrothersDiscovery,0,0,0.49,1643566283.0
Why is the market making these over exaggerated moves on earnings this quarter?,0,7,0.6,1643493106.0
Podcasts or news resources for keeping up with the market,0,6,0.87,1643508553.0
"Never invested before, tips on getting started?",0,27,0.86,1643469298.0
Amazon earnings per share at 27.75. Rev at 137.4. Was at 17.37.,1,16,0.77,1643481469.0
Everywhere I search for an explanation about market order contradicts itself.,-1,3,0.57,1643507213.0
Stock Question on London Exchange,0,132,0.94,1643437746.0
Listening to market expert analyses feels completely useless and empty of actionable information,-1,1512,0.9,1643388853.0
Question regarding equity structure of a company,0,11,0.74,1643482791.0
what stocks have you bought during this crash?,-1,8,0.79,1643487923.0
"Unlike popular opinion, Tesla's valuation is far from unjustifiable - An analysis based on the numbers",1,7,1.0,1643485976.0
Unity beats expectations. Up 16% in pre-market.,0,7,0.9,1643487255.0
SPOT: Cheaper than a traditional FM/AM radio company,0,145,0.88,1643420122.0
Thinking about adding AXP,0,1,0.54,1643503317.0
Does the stock market always go up on payday?,0,31,0.77,1643447659.0
ARKK Step Two,0,377,0.73,1643396579.0
Too much US focus in stock portfolio - European idea generation?,0,4,0.84,1643482608.0
Evaluate my thesis: The January effect in February.,0,4,0.83,1643480417.0
Googles Stock Split and there Historical outcomes,0,1,0.57,1643507176.0
FB Down. SNAP Up. Who's buying what?,0,10,0.82,1643458721.0
Russian invasion of Ukraine play?,1,145,0.81,1643404496.0
Long term investing with ISA or without (UK),0,2,0.63,1643479874.0
Warren Buffett’s Berkshire Hathaway Is Now Bigger Than Meta,0,11,0.63,1643457279.0
Do you think Google will react like Apple and Tesla after their last split and go down 20% after?,1,21,0.83,1643439981.0
Investing vs closing a loan,0,7,0.74,1643457463.0
Bananas for Fresh Del Monte Produce ($FDP),1,0,0.44,1643511382.0
What is the expectation for the jobs report that comes out feb 4th?,0,322,0.86,1643383906.0
"NETZ: New ""Net 0"" ETF. Look at their holdings?!?",0,17,0.67,1643443452.0
Facebook says Apple iOS privacy change will result in $10 billion revenue hit this year,0,0,0.35,1643564029.0
Shell PLC the best major oil& gas,1,42,0.81,1643415234.0
"Jeremy Grantham calling for a 50% crash of the ""super bubble""",1,0,0.5,1643487040.0
What value to look at for growth measure?,1,7,0.67,1643444855.0
Pulling Forward Investments to January,0,0,0.5,1643482859.0
"When selling covered calls, how do you decide what positions to take up?",0,0,0.43,1643523758.0
"Thanks for the lesson, PayPal. Stocks go down for a reason.",1,270,0.68,1643371202.0
Need help with a gift,1,259,0.79,1643370849.0
What I'm seeing with supply chain disruptions: Jan '22 edition,-1,16,0.92,1643418876.0
Best way to give stocks as a gift to my nephew?,1,2857,0.88,1643314320.0
Intraday buying time,0,72,0.84,1643382844.0
Facebooks oculus will disrupt the gaming market over time,0,13,0.62,1643417366.0
Recession or depression?,-1,2,0.67,1643435148.0
Is Microsoft the next GE?,0,19,0.83,1643405656.0
Little Fuse ($LFUS) an alternative to semi-conductors,0,1442,0.85,1643318494.0
Just made a profit on my first ever options trade. Feels pretty good.,1,28,0.82,1643393791.0
Isn't it funny how everyone in the comment section suddenly is now a f*** genius after FB crashed?,-1,440,0.89,1643338757.0
